{
  "spec": {
    "name": "Vale do Silício AGV Runtime Specification",
    "version": "2.0.0",
    "format": "procedural-world-config",
    "language": "pt-BR",
    "purpose": "Gerar automaticamente prédios, lotes, interiores, placas e interações do Vale do Silício AGV dentro do lobby virtual existente."
  },
  "integration": {
    "mode": "append_to_existing_lobby",
    "preserve_existing_lobby": true,
    "existing_scene_id": "lobby_main",
    "new_scene_id": "vale_silicio_agv",
    "entry_portal": {
      "id": "portal_vale_silicio_agv",
      "source_scene": "lobby_main",
      "target_scene": "vale_silicio_agv",
      "label": "VALE DO SILÍCIO AGV",
      "subtitle": "Empresas e projetos criados pelos alunos",
      "spawn_target": "spawn_praca_inovacao",
      "return_portal_id": "portal_retorno_lobby"
    }
  },
  "world": {
    "coordinate_system": "Y_UP",
    "unit": "meter",
    "origin": {
      "x": 0,
      "y": 0,
      "z": 0
    },
    "world_bounds": {
      "min_x": -320,
      "max_x": 320,
      "min_z": -320,
      "max_z": 320
    },
    "main_spawn": {
      "id": "spawn_praca_inovacao",
      "position": {
        "x": 0,
        "y": 0.2,
        "z": -30
      },
      "rotation_y_deg": 0
    },
    "core_landmarks": [
      {
        "id": "praca_inovacao",
        "name": "Praça Central da Inovação",
        "type": "plaza",
        "position": {
          "x": 0,
          "y": 0,
          "z": 0
        },
        "size": {
          "width": 70,
          "depth": 70
        }
      },
      {
        "id": "hall_inovacao_agv",
        "name": "Hall da Inovação AGV",
        "type": "museum_hall",
        "position": {
          "x": 0,
          "y": 0,
          "z": 70
        },
        "size": {
          "width": 48,
          "depth": 30
        }
      },
      {
        "id": "portal_retorno_lobby",
        "name": "Portal de Retorno ao Lobby",
        "type": "portal",
        "position": {
          "x": 0,
          "y": 0,
          "z": -85
        },
        "target_scene": "lobby_main",
        "target_spawn": "lobby_spawn"
      }
    ],
    "roads": {
      "generator": "radial_district_roads",
      "main_road_width": 10,
      "secondary_road_width": 7,
      "sidewalk_width": 2.5,
      "crosswalks": true,
      "street_lights": true,
      "road_markings": true
    },
    "districts": [
      {
        "id": "praca-das-startups",
        "name": "Praça das Startups",
        "center": {
          "x": 0,
          "y": 0,
          "z": 0
        },
        "company_ids": [
          "gitdash",
          "rede-agv",
          "trampo-certo"
        ]
      },
      {
        "id": "distrito-educacao-e-conhecimento",
        "name": "Distrito Educação & Conhecimento",
        "center": {
          "x": 160,
          "y": 0,
          "z": 0
        },
        "company_ids": [
          "agv-school",
          "master-code",
          "plataforma-de-preparatorio-enem",
          "portal-unificado",
          "portal-unificado-gremio-estudantil",
          "portal-escolar-controle-de-pais",
          "projeto-torre-de-babel-site-educacional",
          "simulador-virtual-de-quimica-fisica-e-biologia",
          "sistema-competitivo-quizziz"
        ]
      },
      {
        "id": "distrito-dados-e-sistemas",
        "name": "Distrito Dados & Sistemas",
        "center": {
          "x": -160,
          "y": 0,
          "z": 0
        },
        "company_ids": [
          "dashboard-s-para-analise-de-dados",
          "planilha-de-automacao-com-recibo",
          "sistema-de-inventario-geral",
          "site-de-vendas-geral"
        ]
      },
      {
        "id": "distrito-esportes-e-eventos",
        "name": "Distrito Esportes & Eventos",
        "center": {
          "x": 0,
          "y": 0,
          "z": 160
        },
        "company_ids": [
          "gestao-interclasses-gestao-de-dados",
          "gestao-interclasses-organizacao-geral-do-campeonato",
          "gestao-interclasses-transmissao-e-narracao",
          "site-sobre-futebol",
          "time-para-o-escolares"
        ]
      },
      {
        "id": "distrito-games-e-esports",
        "name": "Distrito Games & eSports",
        "center": {
          "x": 160,
          "y": 0,
          "z": 160
        },
        "company_ids": [
          "campeonato-de-jogos-eletronicos",
          "the-last-quest"
        ]
      },
      {
        "id": "distrito-maker-e-robotica",
        "name": "Distrito Maker & Robótica",
        "center": {
          "x": -160,
          "y": 0,
          "z": 160
        },
        "company_ids": [
          "clube-robotica"
        ]
      },
      {
        "id": "distrito-midia-e-comunicacao",
        "name": "Distrito Mídia & Comunicação",
        "center": {
          "x": 0,
          "y": 0,
          "z": -160
        },
        "company_ids": [
          "clube-da-radio-agv",
          "radio-agv-site"
        ]
      },
      {
        "id": "distrito-imersivo-e-virtual",
        "name": "Distrito Imersivo & Virtual",
        "center": {
          "x": 160,
          "y": 0,
          "z": -160
        },
        "company_ids": [
          "museu-virtual-agv-mundo-virtual-agv"
        ]
      }
    ]
  },
  "procedural_generation": {
    "seed": 20260829,
    "deterministic": true,
    "generation_order": [
      "terrain",
      "roads",
      "districts",
      "lots",
      "buildings",
      "signage",
      "interiors",
      "props",
      "npc_routes",
      "navigation_mesh",
      "interaction_triggers"
    ],
    "lot_rules": {
      "minimum_spacing_between_buildings": 10,
      "front_setback": 6,
      "rear_setback": 4,
      "keep_clear_for_sidewalk": 3
    },
    "fallbacks": {
      "missing_asset": "bldg_generic_tech",
      "missing_sprite": "sprite_generic_project",
      "missing_role_text": "Função ainda não cadastrada",
      "missing_description": "Projeto estudantil em desenvolvimento."
    }
  },
  "rendering_profiles": {
    "2D_LOW": {
      "mode": "2D",
      "target": "máquinas de baixo desempenho",
      "building_representation": "sprites_or_tile_buildings",
      "interior_representation": "separate_room_scene_or_modal",
      "dynamic_lights": false,
      "ambient_npcs_max": 12,
      "particles": "low",
      "shadows": "off"
    },
    "3D_BALANCED": {
      "mode": "3D",
      "target": "máquinas intermediárias",
      "building_representation": "low_poly_3d",
      "dynamic_lights": true,
      "ambient_npcs_max": 24,
      "particles": "medium",
      "shadows": "medium"
    },
    "3D_ULTRA": {
      "mode": "3D",
      "target": "máquinas de alto desempenho",
      "building_representation": "full_3d",
      "dynamic_lights": true,
      "ambient_npcs_max": 45,
      "particles": "high",
      "shadows": "high",
      "reflections": true
    }
  },
  "ui": {
    "map_enabled": true,
    "minimap_enabled": true,
    "district_filter_enabled": true,
    "company_search_enabled": true,
    "fast_travel_enabled": true,
    "building_panel_fields": [
      "display_name",
      "project_name",
      "data_bindings.turmas",
      "data_bindings.leaders",
      "data_bindings.member_count",
      "data_bindings.description"
    ]
  },
  "companies": [
    {
      "id": "dashboard-s-para-analise-de-dados",
      "enabled": true,
      "company_name": "Dashboard's para análise de dados",
      "display_name": "Dashboard's para análise de dados",
      "project_name": "Dashboard's para análise de dados",
      "aliases": [],
      "category": "data_systems",
      "zone": "Distrito Dados & Sistemas",
      "lot": {
        "lot_id": "LOT-001",
        "world_position": {
          "x": -160.0,
          "y": 0,
          "z": -48.0
        },
        "rotation_y_deg": 0.0,
        "size": {
          "width": 42.0,
          "depth": 38.0
        },
        "road_connection": true,
        "sidewalk_connection": true,
        "landscape_preset": "tech_campus_default",
        "spawn_anchor": "spawn_dashboard-s-para-analise-de-dados"
      },
      "building": {
        "archetype": "bldg_data_tower",
        "asset_key": "bldg_data_tower",
        "scale": 1.0,
        "footprint": {
          "width": 28.0,
          "depth": 24.0
        },
        "floors": 4,
        "roof_style": "flat",
        "facade_style": "glass_grid",
        "interior_template": "interior_analytics",
        "theme_description": "torre de analytics com dashboards gigantes, telões de BI e centro de dados",
        "lod": {
          "lod0_distance": 35,
          "lod1_distance": 75,
          "lod2_distance": 140,
          "billboard_distance": 220,
          "disable_interior_distance": 55
        },
        "collision": {
          "enabled": true,
          "type": "compound_boxes",
          "walkable_entry": true,
          "stairs_have_collision": true
        },
        "navigation": {
          "navmesh_enabled": true,
          "entrance_nav_link": true,
          "npc_walkable": true
        }
      },
      "signage": {
        "front_sign": {
          "text": "Dashboard's para análise de dados",
          "subtext": "analytics e BI",
          "visible_distance": 95,
          "billboard_to_camera": false
        },
        "lot_totem": {
          "enabled": true,
          "fields": [
            "company_name",
            "project_name",
            "turmas",
            "leaders",
            "member_count"
          ]
        },
        "team_wall_inside": true
      },
      "interaction": {
        "trigger_radius": 5.5,
        "on_approach_panel": true,
        "enter_building": true,
        "show_team": true,
        "show_project": true,
        "fast_travel_unlock_on_visit": true,
        "buttons": [
          "Conhecer projeto",
          "Entrar no prédio",
          "Ver equipe"
        ]
      },
      "interior": {
        "enabled": true,
        "stream_on_enter": true,